{
  "openapi": "3.1.0",
  "info": {
    "title": "OpenAPI 3.1 Demo for AGENTE STAMPA 3D",
    "version": "0.1.0",
    "description": "A demo OpenAPI 3.1.0 spec for API endpoints, designed to test custom Spectral rules and provide a clear API contract for 3D printing job searching, calendar integration, and file upload.",
    "contact": {
      "name": "AGENTE STAMPA 3D Support",
      "url": "https://project.example.com/support",
      "email": "support@project.example.com"
    }
  },
  "servers": [
    {
      "url": "http://localhost:8000",
      "description": "Development server"
    }
  ],
  "tags": [
    {
      "name": "Jobs",
      "description": "Operations related to job searching."
    },
    {
      "name": "Calendar",
      "description": "Operations related to calendar events."
    },
    {
      "name": "Upload",
      "description": "Operations related to file uploads."
    }
  ],
  "security": [
    {
      "ApiKeyAuth": []
    }
  ],
  "paths": {
    "/api/v1/upload": {
      "post": {
        "summary": "Upload a 3D model file",
        "description": "Upload an STL or OBJ file for 3D printing. Files are validated for type and size.",
        "operationId": "uploadModel",
        "tags": ["Upload"],
        "parameters": [],
        "requestBody": {
          "required": true,
          "content": {
            "multipart/form-data": {
              "schema": {
                "type": "object",
                "properties": {
                  "file": {
                    "type": "string",
                    "format": "binary",
                    "description": "The 3D model file to upload (STL, OBJ)"
                  },
                  "webhook_url": {
                    "type": ["string", "null"],
                    "format": "uri",
                    "description": "Optional webhook URL to notify when processing completes"
                  },
                  "max_size_bytes": {
                    "type": ["integer", "null"],
                    "description": "Optional override for maximum upload size in bytes",
                    "exclusiveMinimum": 0
                  }
                },
                "required": ["file"]
              }
            }
          }
        },
        "responses": {
          "201": {
            "description": "File upload result with metadata and storage information",
            "content": {
              "application/json": {
                "schema": {
                  "$ref": "#/components/schemas/UploadResult"
                }
              }
            }
          },
          "400": {
            "description": "Bad request - file is missing or has no name",
            "content": {
              "application/json": {
                "schema": {
                  "$ref": "#/components/schemas/Error"
                }
              }
            }
          },
          "413": {
            "description": "Payload too large - file exceeds size limit",
            "content": {
              "application/json": {
                "schema": {
                  "$ref": "#/components/schemas/Error"
                }
              }
            }
          },
          "415": {
            "description": "Unsupported media type - file type not allowed",
            "content": {
              "application/json": {
                "schema": {
                  "$ref": "#/components/schemas/Error"
                }
              }
            }
          },
          "422": {
            "description": "Unprocessable entity - validation failed",
            "content": {
              "application/json": {
                "schema": {
                  "$ref": "#/components/schemas/Error"
                }
              }
            }
          },
          "429": {
            "description": "Too many requests - rate limit exceeded",
            "content": {
              "application/json": {
                "schema": {
                  "$ref": "#/components/schemas/Error"
                }
              }
            },
            "headers": {
              "X-RateLimit-Limit": {
                "schema": {
                  "type": "integer"
                },
                "description": "The rate limit ceiling for this API"
              },
              "X-RateLimit-Remaining": {
                "schema": {
                  "type": "integer"
                },
                "description": "The number of requests left for the time window"
              },
              "X-RateLimit-Reset": {
                "schema": {
                  "type": "integer"
                },
                "description": "The remaining time window in seconds"
              }
            }
          },
          "500": {
            "description": "Server error during upload",
            "content": {
              "application/json": {
                "schema": {
                  "$ref": "#/components/schemas/Error"
                }
              }
            }
          }
        }
      }
    },
    "/searchJobs": {
      "get": {
        "summary": "Ricerca lavori di stampa 3D disponibili su marketplace online",
        "description": "Trova opportunità di lavoro di stampa 3D su piattaforme come Upwork, Freelancer e Indeed. Supporta filtri per parole chiave, località, budget minimo e tag. Restituisce un elenco dettagliato di lavori con titolo, descrizione, budget e dettagli del committente. Utile per chi cerca progetti di stampa 3D freelance o opportunità di collaborazione.",
        "operationId": "searchJobs",
        "tags": ["Jobs"],
        "parameters": [
          {
            "name": "keyword",
            "in": "query",
            "description": "Search keyword for jobs.",
            "required": false,
            "schema": {
              "type": "string"
            }
          },
          {
            "name": "location",
            "in": "query",
            "description": "Location filter for jobs. Uses OpenAPI 3.1 style nullability.",
            "schema": {
              "type": ["string", "null"]
            }
          },
          {
            "name": "min_budget",
            "in": "query",
            "description": "Minimum budget for the job. Must be greater than 0.",
            "schema": {
                "type": "number",
                "exclusiveMinimum": 0 
            }
          },
          {
            "name": "tags",
            "in": "query",
            "description": "Tags to filter jobs by. Intentionally uses a non-standard style to test array-query-param-style-explode rule.",
            "required": false,
            "schema": {
              "type": "array",
              "items": {
                "type": "string"
              }
            },
            "style": "form",
            "explode": true
          }
        ],
        "responses": {
          "200": {
            "description": "Successful search results.",
            "content": {
              "application/json": {
                "schema": {
                  "type": "object",
                  "properties": {
                    "results": {
                      "type": "array",
                      "items": {
                        "$ref": "#/components/schemas/Job"
                      }
                    },
                    "count": {
                      "type": "integer",
                      "minimum": 0
                    }
                  }
                }
              }
            }
          },
          "400": {
            "description": "Invalid request parameters.",
            "content": {
              "application/json": {
                "schema": {
                  "$ref": "#/components/schemas/Error"
                }
              }
            }
          }
        }
      }
    },
    "/addToCalendar": {
      "post": {
        "summary": "Aggiungi un evento di stampa 3D al calendario Google",
        "description": "Crea un nuovo evento nel calendario Google dell'utente per tracciare scadenze, appuntamenti con clienti o sessioni di stampa. Supporta titolo, descrizione, orari di inizio/fine e lista partecipanti. L'operazione richiede autenticazione OAuth2 con Google Calendar API, con scopes 'calendar.events' e 'calendar.readonly'. L'evento creato viene automaticamente sincronizzato su tutti i dispositivi dell'utente collegati al suo account Google.",
        "operationId": "addToCalendar",
        "tags": ["Calendar"],
        "requestBody": {
          "required": true,
          "content": {
            "application/json": {
              "schema": {
                "$ref": "#/components/schemas/CalendarEvent"
              }
            }
          }
        },
        "responses": {
          "201": {
            "description": "Event successfully added to calendar.",
            "content": {
              "application/json": {
                "schema": {
                  "type": "object",
                  "properties": {
                    "eventId": {
                      "type": "string"
                    },
                    "status": {
                      "type": "string",
                      "example": "confirmed"
                    }
                  }
                }
              }
            }
          },
          "401": {
            "description": "Unauthorized - API Key missing or invalid.",
            "content": {
              "application/json": {
                "schema": {
                  "$ref": "#/components/schemas/Error"
                }
              }
            }
          },
          "422": {
            "description": "Validation error for request body.",
            "content": {
              "application/json": {
                "schema": {
                  "$ref": "#/components/schemas/Error"
                }
              }
            }
          }
        }
      }
    }
  },
  "components": {
    "schemas": {